{
  "schema_version": "0.1.1-draft",
  "task_id": "constraints",
  "revision": 1,
  "next_step": "inspect",
  "references": [
    {
      "id": "request-1",
      "kind": "user_request",
      "availability": "supplied",
      "content": "Review the supplied clamp function for inputs outside the range. Do not change its public signature. Prefer a concise report."
    },
    {
      "id": "function-source",
      "kind": "document",
      "availability": "supplied",
      "locator": "example/clamp.js",
      "content": "export function clamp(value, min, max) {\n  return Math.min(max, Math.max(min, value));\n}"
    }
  ],
  "items": [
    {
      "id": "objective-1",
      "kind": "objective",
      "text": "Review the supplied clamp function for inputs outside the range.",
      "origin": "user_stated",
      "source_ids": ["request-1"],
      "review": {
        "state": "unreviewed"
      }
    },
    {
      "id": "clamp-source",
      "kind": "context",
      "text": "The supplied source defines clamp(value, min, max) using Math.min and Math.max.",
      "origin": "source_reported",
      "source_ids": ["function-source"],
      "review": { "state": "unreviewed" }
    },
    {
      "id": "signature",
      "kind": "constraint",
      "text": "Do not change the public signature.",
      "origin": "user_stated",
      "source_ids": ["request-1"],
      "review": {
        "state": "unreviewed"
      },
      "strength": "hard"
    },
    {
      "id": "concise",
      "kind": "constraint",
      "text": "Prefer a concise report.",
      "origin": "user_stated",
      "source_ids": ["request-1"],
      "review": {
        "state": "unreviewed"
      },
      "strength": "preference"
    }
  ],
  "unknowns": [
    {
      "id": "tone",
      "question": "Would a more formal tone help?",
      "necessity": "optional",
      "blocks": [],
      "next_action": "ask_user",
      "status": "open"
    }
  ],
  "conflicts": []
}
