{
  "schema_version": "0.1.1-draft",
  "task_id": "unconfirmed-scope",
  "revision": 1,
  "next_step": "clarify",
  "references": [
    {
      "id": "request-1",
      "kind": "user_request",
      "availability": "supplied",
      "content": "Review my app and tell me what needs fixing."
    }
  ],
  "items": [
    {
      "id": "objective-1",
      "kind": "objective",
      "text": "Review my app and tell me what needs fixing.",
      "origin": "user_stated",
      "source_ids": ["request-1"],
      "review": {
        "state": "unreviewed"
      }
    },
    {
      "id": "release-review",
      "kind": "objective",
      "text": "Assess production readiness.",
      "origin": "inferred",
      "source_ids": ["request-1"],
      "review": {
        "state": "unreviewed"
      },
      "rationale": "Release readiness is one possible interpretation of review."
    }
  ],
  "unknowns": [
    {
      "id": "review-kind",
      "question": "Which kind of review would be useful?",
      "necessity": "important",
      "blocks": [],
      "next_action": "ask_user",
      "status": "open"
    }
  ],
  "conflicts": []
}
