{
  "schema_version": "0.1.1-draft",
  "task_id": "constraint-strength",
  "revision": 1,
  "next_step": "clarify",
  "references": [
    {
      "id": "request-1",
      "kind": "user_request",
      "availability": "supplied",
      "content": "Review the function. Do not change its public signature. Prefer a concise report."
    }
  ],
  "items": [
    {
      "id": "objective-1",
      "kind": "objective",
      "text": "Review the function. Do not change its public signature. Prefer a concise report.",
      "origin": "user_stated",
      "source_ids": ["request-1"],
      "review": {
        "state": "unreviewed"
      }
    },
    {
      "id": "signature",
      "kind": "constraint",
      "text": "Do not change the public signature.",
      "origin": "user_stated",
      "source_ids": ["request-1"],
      "review": {
        "state": "unreviewed"
      },
      "strength": "hard"
    },
    {
      "id": "concise",
      "kind": "constraint",
      "text": "Prefer a concise report.",
      "origin": "user_stated",
      "source_ids": ["request-1"],
      "review": {
        "state": "unreviewed"
      },
      "strength": "preference"
    }
  ],
  "unknowns": [
    {
      "id": "tone",
      "question": "Would a more formal tone help?",
      "necessity": "optional",
      "blocks": [],
      "next_action": "ask_user",
      "status": "open"
    }
  ],
  "conflicts": []
}
